{
  "schemaVersion": 1,
  "catalogVersion": "1.0.0",
  "manualAsOf": "2026-09-15",
  "contentDigest": "d087e185fa3928d2b288afe325e54d2d114b64f98bb65f1351e33d17fca33651",
  "dexDeployments": [
    {
      "dexDeploymentId": "dex-deployment-0001",
      "protocolId": "uniswap-v2",
      "name": "Uniswap V2",
      "chainId": "eip155:1",
      "programAddress": "0x5c69bee701ef814a2b6a3edd4b1652cb9cc5aa6f",
      "adapterKind": "evm-constant-product-v2",
      "status": "active",
      "replacedByDexDeploymentId": null,
      "evidence": [
        "https://github.com/Uniswap/v2-core/blob/6a9e7c97860676e0992f22a49665760444c1cdf5/contracts/UniswapV2Factory.sol",
        "https://github.com/Uniswap/v2-core/blob/6a9e7c97860676e0992f22a49665760444c1cdf5/contracts/UniswapV2Pair.sol"
      ],
      "asOfDate": "2026-09-15"
    },
    {
      "dexDeploymentId": "dex-deployment-0002",
      "protocolId": "lfj-legacy-constant-product",
      "name": "LFJ legacy constant-product (Joe V1)",
      "chainId": "eip155:43114",
      "programAddress": "0x9ad6c38be94206ca50bb0d90783181662f0cfa10",
      "adapterKind": "evm-constant-product-v2",
      "status": "active",
      "replacedByDexDeploymentId": null,
      "evidence": [
        "https://docs.lfj.gg/lfj-dex/contracts",
        "https://github.com/lfj-gg/joe-core/blob/5bec2f3d86500bfd81038c99afe702ee7e67af3e/contracts/traderjoe/JoePair.sol"
      ],
      "asOfDate": "2026-09-15"
    },
    {
      "dexDeploymentId": "dex-deployment-0003",
      "protocolId": "orca-whirlpools",
      "name": "Orca Whirlpools",
      "chainId": "solana:5eykt4UsFv8P8NJdTREpY1vzqKqZKvdp",
      "programAddress": "whirLbMiicVdio4qvUfM5KAg6Ct8VwpYzGff3uctyCc",
      "adapterKind": "solana-orca-whirlpool",
      "status": "active",
      "replacedByDexDeploymentId": null,
      "evidence": [
        "https://docs.orca.so/developers/architecture/whirlpool-parameters",
        "https://github.com/orca-so/whirlpools/blob/408c945fef4c49ab70def4303377cfaf8f0f3c99/programs/whirlpool/src/state/whirlpool.rs"
      ],
      "asOfDate": "2026-09-15"
    },
    {
      "dexDeploymentId": "dex-deployment-0004",
      "protocolId": "raydium-clmm",
      "name": "Raydium CLMM",
      "chainId": "solana:5eykt4UsFv8P8NJdTREpY1vzqKqZKvdp",
      "programAddress": "CAMMCzo5YL8w4VFF8KVHrK22GGUsp5VTaW7grrKgrWqK",
      "adapterKind": "solana-raydium-clmm",
      "status": "active",
      "replacedByDexDeploymentId": null,
      "evidence": [
        "https://docs.raydium.io/reference/program-addresses",
        "https://github.com/raydium-io/raydium-clmm/blob/ed7c84a54ced59c55981780546adb0b4583dcf85/programs/amm/src/states/pool.rs"
      ],
      "asOfDate": "2026-09-15"
    }
  ],
  "poolDefinitions": [
    {
      "poolDefinitionId": "discovered-pool-1568e761c62f7dc58207a77f2dc32153805efe03a8d9cce9366ce68efdf276c4",
      "dexDeploymentId": "dex-deployment-0002",
      "chainId": "eip155:43114",
      "address": "0xd5a37dc5c9a396a03dd1136fc76a1a02b1c88ffa",
      "token0DeploymentId": "discovered-token-9f9965cc065c9becf8d2cb58071524baafea37d27fda9bf683a93ea85f2e653d",
      "token1DeploymentId": "deployment-0004",
      "adapter": {
        "kind": "evm-constant-product-v2",
        "feeNumerator": "3",
        "feeDenominator": "1000"
      },
      "status": "active",
      "replacedByPoolDefinitionId": null,
      "evidence": [
        "https://api.avax.network/ext/bc/C/rpc"
      ],
      "asOfDate": "2026-09-16"
    },
    {
      "poolDefinitionId": "discovered-pool-1b98a5f24a364e05b3d56a9702c3560fc3a71f84b2195c486cfc5f8a956cc0b7",
      "dexDeploymentId": "dex-deployment-0001",
      "chainId": "eip155:1",
      "address": "0xc2adda861f89bbb333c90c492cb837741916a225",
      "token0DeploymentId": "discovered-token-b475569f6a15e97ac04e531dd813e9dcc902521c098d60d6ae4d21d53baf1395",
      "token1DeploymentId": "deployment-0002",
      "adapter": {
        "kind": "evm-constant-product-v2",
        "feeNumerator": "3",
        "feeDenominator": "1000"
      },
      "status": "active",
      "replacedByPoolDefinitionId": null,
      "evidence": [
        "https://ethereum-rpc.publicnode.com"
      ],
      "asOfDate": "2026-09-16"
    },
    {
      "poolDefinitionId": "discovered-pool-3c1e38d02092d16e396d2f3a22b2bfae55246a1c566831d31f211670e45bd562",
      "dexDeploymentId": "dex-deployment-0002",
      "chainId": "eip155:43114",
      "address": "0xed8cbd9f0ce3c6986b22002f03c6475ceb7a6256",
      "token0DeploymentId": "deployment-0004",
      "token1DeploymentId": "discovered-token-288036a90ee0fa72a2751a78a6934cc6ced9e16de91c97ae8e109e2ee6189bc5",
      "adapter": {
        "kind": "evm-constant-product-v2",
        "feeNumerator": "3",
        "feeDenominator": "1000"
      },
      "status": "active",
      "replacedByPoolDefinitionId": null,
      "evidence": [
        "https://api.avax.network/ext/bc/C/rpc"
      ],
      "asOfDate": "2026-09-16"
    },
    {
      "poolDefinitionId": "discovered-pool-3f840a40991e755e42d242188bd8deb85cd5b9655308269b00c220f5237710cf",
      "dexDeploymentId": "dex-deployment-0002",
      "chainId": "eip155:43114",
      "address": "0xfe15c2695f1f920da45c30aae47d11de51007af9",
      "token0DeploymentId": "discovered-token-0a7f98c8752f15ee02ce0d801f25df8ff78864a1d70aff7e204f7bdb3f8a0692",
      "token1DeploymentId": "deployment-0004",
      "adapter": {
        "kind": "evm-constant-product-v2",
        "feeNumerator": "3",
        "feeDenominator": "1000"
      },
      "status": "active",
      "replacedByPoolDefinitionId": null,
      "evidence": [
        "https://api.avax.network/ext/bc/C/rpc"
      ],
      "asOfDate": "2026-09-16"
    },
    {
      "poolDefinitionId": "discovered-pool-5d7aa6a767a0c6ea9ddeb06d1289bd12d85018935d5b25724b165dc8b9832252",
      "dexDeploymentId": "dex-deployment-0002",
      "chainId": "eip155:43114",
      "address": "0x48f7c83c29e5ecea926d8169864d8cd022deaf3c",
      "token0DeploymentId": "discovered-token-323d07c442f0d089197ae7eea9b3ebb829910177c5b780161a7623aaed5e4371",
      "token1DeploymentId": "deployment-0004",
      "adapter": {
        "kind": "evm-constant-product-v2",
        "feeNumerator": "3",
        "feeDenominator": "1000"
      },
      "status": "active",
      "replacedByPoolDefinitionId": null,
      "evidence": [
        "https://api.avax.network/ext/bc/C/rpc"
      ],
      "asOfDate": "2026-09-16"
    },
    {
      "poolDefinitionId": "discovered-pool-6428a1e5da293b2ef62027ec823ba27532219a40784def3930feee56a623b809",
      "dexDeploymentId": "dex-deployment-0001",
      "chainId": "eip155:1",
      "address": "0xa2107fa5b38d9bbd2c461d6edf11b11a50f6b974",
      "token0DeploymentId": "deployment-0057",
      "token1DeploymentId": "deployment-0002",
      "adapter": {
        "kind": "evm-constant-product-v2",
        "feeNumerator": "3",
        "feeDenominator": "1000"
      },
      "status": "active",
      "replacedByPoolDefinitionId": null,
      "evidence": [
        "https://ethereum-rpc.publicnode.com"
      ],
      "asOfDate": "2026-09-16"
    },
    {
      "poolDefinitionId": "discovered-pool-866f890448d13c078e217a894ebd47430da5941fe5bff7e382fc095916b4614d",
      "dexDeploymentId": "dex-deployment-0001",
      "chainId": "eip155:1",
      "address": "0xb6909b960dbbe7392d405429eb2b3649752b4838",
      "token0DeploymentId": "discovered-token-69519fd08e31445cad84b0c17a5346b7ee9c5692e270602af9308ca6d8943bb6",
      "token1DeploymentId": "deployment-0002",
      "adapter": {
        "kind": "evm-constant-product-v2",
        "feeNumerator": "3",
        "feeDenominator": "1000"
      },
      "status": "active",
      "replacedByPoolDefinitionId": null,
      "evidence": [
        "https://ethereum-rpc.publicnode.com"
      ],
      "asOfDate": "2026-09-16"
    },
    {
      "poolDefinitionId": "discovered-pool-8ee383c33ce263c33d72015ed1d41841d11eb7de663aeb314c14447248b6522b",
      "dexDeploymentId": "dex-deployment-0001",
      "chainId": "eip155:1",
      "address": "0x0d4a11d5eeaac28ec3f61d100daf4d40471f1852",
      "token0DeploymentId": "deployment-0002",
      "token1DeploymentId": "deployment-0014",
      "adapter": {
        "kind": "evm-constant-product-v2",
        "feeNumerator": "3",
        "feeDenominator": "1000"
      },
      "status": "active",
      "replacedByPoolDefinitionId": null,
      "evidence": [
        "https://ethereum-rpc.publicnode.com"
      ],
      "asOfDate": "2026-10-17"
    },
    {
      "poolDefinitionId": "discovered-pool-90805f8995c1d0b85a45fcd4587928a00066b1f14407baee4e8ed1b634c07804",
      "dexDeploymentId": "dex-deployment-0001",
      "chainId": "eip155:1",
      "address": "0x55d5c232d921b9eaa6b37b5845e439acd04b4dba",
      "token0DeploymentId": "discovered-token-611597bd13daa43d01a23caa9cca6a98797c64be7fb5b2677370ddbcdeaf01ec",
      "token1DeploymentId": "deployment-0002",
      "adapter": {
        "kind": "evm-constant-product-v2",
        "feeNumerator": "3",
        "feeDenominator": "1000"
      },
      "status": "active",
      "replacedByPoolDefinitionId": null,
      "evidence": [
        "https://ethereum-rpc.publicnode.com"
      ],
      "asOfDate": "2026-09-16"
    },
    {
      "poolDefinitionId": "discovered-pool-9e4ed76f76904a4ae271946bb1a4b2dc7428e343040b05a42707071bbfac9462",
      "dexDeploymentId": "dex-deployment-0002",
      "chainId": "eip155:43114",
      "address": "0x6f3a0c89f611ef5dc9d96650324ac633d02265d3",
      "token0DeploymentId": "deployment-0058",
      "token1DeploymentId": "deployment-0004",
      "adapter": {
        "kind": "evm-constant-product-v2",
        "feeNumerator": "3",
        "feeDenominator": "1000"
      },
      "status": "active",
      "replacedByPoolDefinitionId": null,
      "evidence": [
        "https://api.avax.network/ext/bc/C/rpc"
      ],
      "asOfDate": "2026-09-16"
    },
    {
      "poolDefinitionId": "discovered-pool-a2480f3d4ea5ce12252126acf64b174b9fe678b0f0fda8936a12fef180ae08cd",